wra,Temporary Assembly Center,15,Tanforan,https://encyclopedia.densho.org/Tanforan_(detention_facility)/,published,"April 28, 1942","October 13, 1942","The Tanforan Assembly Center was located on the site of the Tanforan Racetrack in San Bruno, California. It was the second largest of the temporary WCCA camps, located 20 miles south of San Francisco, near the San Francisco International Airport. The camp was occupied from April 28 to October 13, 1942, a total of 171 days. Holding Japanese Americans mostly from the San Francisco Bay Area, its peak population was 7,816. All in all, 8,033 Americans of Japanese ancestry were incarcerated at Tanforan, 64 per cent of whom were U.S. citizens. About half of the inmates lived in former horse stalls. 98 per cent of the 7,824 Japanese Americans in Tanforan who were transferred to ""relocation centers"" were sent to the Central Utah WRA camp also known as Topaz. The site was subsequently used as a training camp by the VII Army Corps. A shopping center sits on the site today, a small historical marker commemorating its World War II history.","Located 12 miles south of San Francisco, California.",7816,1942-07-25,7816,"San Bruno, California",California,37.63639350072774,-122.4178663033512,"Courtesy of WRA no. C-141, War Relocation Authority Photographs of Japanese-American Evacuation and Resettlement, The Bancroft Library, University of California, Berkeley. Accessed from: https://encyclopedia.densho.org/sources/en-tanforan-3/"
wra,Temporary Assembly Center,16,Stockton,https://encyclopedia.densho.org/Stockton_(detention_facility)/,published,"May 10, 1942","October 17, 1942","The Stockton Assembly Center was built on the site of the San Joaquin County Fairgrounds southeast of downtown Stockton. Inmates lived in newly constructed barracks located both within the fairgrounds racetrack and adjacent to it. Nearly its entire inmate population came from Stockton, Lodi and surrounding farming areas in San Joaquin County. The first advance inmate groups arrived on May 10, 1942, and the camp's peak population of 4,271 was reached just eleven days later. The camp remained in operation for over five months, making it one of the longest running of the assembly centers and resulting in a relatively more robust inmate-run educational program. Essentially the entire population of Stockton went to Rohwer , with a small number of tuberculosis patients and their families going instead to Gila River .","Located at the San Joaquin County Fairgrounds in Stockton, California.",4271,1942-05-21,4271,"Stockton, California",California,37.93729616824986,-121.267282529392,"Courtesy of WRA no. C-395, War Relocation Authority Photographs of Japanese-American Evacuation and Resettlement, The Bancroft Library, University of California, Berkeley. Accessed from: https://encyclopedia.densho.org/sources/en-stockton-1/"
wra,Temporary Assembly Center,17,Turlock,https://encyclopedia.densho.org/Turlock_(detention_facility)/,published,"April 30, 1942","August 12, 1942","The Turlock Assembly Center had the third smallest peak population among "" assembly centers ,"" at 3,662 and was open for 105 days, from April 30 to August 12, 1942. Built on the site of the Stanislaus County Fairgrounds in Turlock, its inmate population was one of the most diverse of any ""assembly center"" and mostly consisted of people who had to travel a substantial distance to get there. The main population groups included contingents from Vacaville and other parts of Solano County, the San Francisco Bay Area (particularly the East Bay), Little Tokyo in Los Angeles, and Walnut Grove. The entire population eventually transferred to the Gila River , Arizona, War Relocation Authority concentration camp. Still the site of the fairgrounds, a small historical marker and two storyboards memorialize the site today.","Located in the town of Turlock, California.",3661,1942-06-02,3661,"Turlock, California",California,37.50179351452003,-120.858163760034,Courtesy of Densho. Accessed from: https://encyclopedia.densho.org/sources/en-denshopd-i224-00013-1/
wra,Temporary Assembly Center,18,Salinas,https://encyclopedia.densho.org/Salinas_(detention_facility)/,published,"April 27, 1942","July 4, 1942","The Salinas Assembly Center was located at the Salinas Race Track and Fair Grounds at the north end of Salinas. The third least populous of the "" assembly centers "" with a peak population of 3,594, its inmate population consisted almost entirely of Japanese Americans from nearby agricultural communities including Watsonville, Salinas, and Gilroy. Despite being open for a short sixty-nine days (April 27 to July 4, 1942), it had an active community government under camp manager E. A. Rose and many recreational and educational programs. Nearly the entire population of the camp was transferred on to Poston between June 28 and July 4, 1942.","Located at the north end of the town of Salinas, California.",3586,1942-06-23,3586,"Salinas, California",California,36.69115184830009,-121.651304132748,"Courtesy of WRA no. C-68, War Relocation Authority Photographs of Japanese-American Evacuation and Resettlement, The Bancroft Library, University of California, Berkeley. Accessed from: https://encyclopedia.densho.org/sources/en-salinas-1/Courtesy of WRA no. C-68, War Relocation Authority Photographs of Japanese-American Evacuation and Resettlement, The Bancroft Library, University of California, Berkeley"
wra,Temporary Assembly Center,19,Merced,https://encyclopedia.densho.org/Merced_(detention_facility)/,published,"May 6, 1942","September 15, 1942","The Merced Assembly Center, built on the Merced County Fairgrounds property, was populated from May 6 to September 15, 1942, a total of 133 days, and had a peak population of 4,508, making it near the median among "" assembly centers "" in both categories. The inmates came mostly from rural areas and small towns in Central California as well as north coastal areas above San Francisco. They were housed in just under two hundred hastily built barracks east of the racetrack. As with other Central California assembly centers, inmates battled intense heat and insects as well the usual cramped quarters, lines, and lack of privacy. Essentially the entire population went to the Amache , Colorado, concentration camp in September. A memorial dedicated in 2010 stands at the site of the camp today.",Located in California's central San Joaquin Valley within the town of Merced at the county fairgrounds; the buildings were sited south of the fairgrounds proper.,4508,1942-06-03,4508,"Merced, California",California,37.2922985835873,-120.4815394613918,Courtesy of Densho. Accessed from: https://encyclopedia.densho.org/sources/en-denshopd-i247-00001-1/
wra,Temporary Assembly Center,20,Pinedale,https://encyclopedia.densho.org/Pinedale_(detention_facility)/,published,"May 7, 1942","July 23, 1942","Pinedale Assembly Center was located in Fresno, California, eight miles north of downtown and just twelve miles from the Fresno Assembly Center . Pinedale was somewhat unique among assembly centers in that most of its population came from far away. Most came from Washington state; nearly all of the Japanese Americans removed from the western part of the state except for those from the city of Seattle came to Pinedale, along with the population of Hood River, Oregon. The remainder of the population, about 15%, came from the Sacramento area. Medium sized among assembly centers with a peak population of around 4,800, Pinedale was operational for a short 78 days, from May 7 to July 23. As such, it was relatively limited in the scope of its institutions, in particular having very limited educational programs and medical facilities. It was also unusual for an assembly center in that all of the buildings for it were newly constructed, as it did not make use of any existing facilities. The summer heat was a major issue among inmates, particularly since its population mostly came from the much cooler Pacific Northwest. For the most part, the Pacific Northwest people were subsequently sent to Tule Lake , while the California people went to Poston .","Located 8 miles north of downtown Fresno, California.",4792,1942-06-29,4792,"Pinedale, California",California,36.84437735635104,-119.8044273763797,Courtesy of Densho. Accessed from: https://encyclopedia.densho.org/sources/en-denshopd-i224-00005-1/
wra,Temporary Assembly Center,21,Fresno,https://encyclopedia.densho.org/Fresno_(detention_facility)/,published,"May 6, 1942","October 30, 1942","The Fresno Assembly Center, built on the site of the Fresno County Fairgrounds just east of downtown Fresno, was populated from May 6 to October 30, a total of 177 days, making it one of the longest running assembly centers and the last to close. Its population came almost entirely from the Central Valley, including the city and county of Fresno as well as Kings County, Tulare County and part of the Florin/Elk Grove community south of Sacramento. Medium sized among assembly centers in population with a peak of 5,120, it was located only about twelve miles from the Pinedale Assembly Center . Nearly its entire population was transferred to the Jerome , Arkansas WRA concentration camp.",Located at the Fresno County Fairgrounds in central California.,5120,1942-09-04,5120,"Fresno, California",California,36.73338487706776,-119.7472619407948,Courtesy of Densho. Accessed from: https://encyclopedia.densho.org/sources/en-denshopd-i224-00001-1/
wra,Temporary Assembly Center,22,Tulare,https://encyclopedia.densho.org/Tulare_(detention_facility)/,published,"April 20, 1942","September 4, 1942","Tulare was a temporary detention camp, located in the Southern San Joaquin Valley, half-way between Fresno and Bakersfield, on the outskirts of the city of Tulare (pop. 10,000). It was built on grounds formerly used by the Tulare-Kings County Fair. The camp was occupied from April 27 to September 4, 1942, a total of 131 days. It housed 5,061 Nikkei (with a maximum at one time of 4,978), mostly from the coastal counties north of Los Angeles. There were about 100 barracks within the fairgrounds and another 55 barracks to the south of the fairgrounds adjacent to the county hospital. After spending about four months in the camp most Nikkei were deported to the Gila River camp in Southern Arizona. The grounds were thereafter occupied by African American soldiers of the 7th Army Corps.",Located in the southern San Joaquin Valley of California.,4978,1942-08-11,4978,"Tulare, California",California,36.19893740683506,-119.3420855382406,Courtesy of Densho. Accessed from: https://encyclopedia.densho.org/sources/en-denshopd-i224-00012-1/
wra,Temporary Assembly Center,23,Santa Anita,https://encyclopedia.densho.org/Santa_Anita_(detention_facility)/,published,"March 27, 1942","October 27, 1942","Located at the Santa Anita Racetrack in the city of Arcadia, approximately thirteen miles northeast of downtown Los Angeles and twenty miles west of the Pomona Assembly Center , Santa Anita was occupied from March 27 until October 27, 1942, a total of 215 days. Santa Anita was the largest and the longest-occupied of the temporary WCCA camps. Its peak population was 18,719. Over 8,500 Japanese Americans lived in converted horse stalls at the racetrack. It was the only WCCA camp to run a camouflage net factory , operated under military contract. The majority of Santa Anita's inmates were eventually transferred to Heart Mountain , Rohwer , Amache , and Jerome .","Located at the world-famous Santa Anita Racetrack in Arcadia, California.",18719,1942-08-23,18719,"Arcadia, California",California,34.14056064351376,-118.0444206861681,"Courtesy of WRA no. -407, War Relocation Authority Photographs of Japanese-American Evacuation and Resettlement, The Bancroft Library, University of California, Berkeley. Accessed from: https://encyclopedia.densho.org/sources/en-santaanita-1/"
wra,Temporary Assembly Center,24,Pomona,https://encyclopedia.densho.org/Pomona_(detention_facility)/,published,"May 7, 1942","August 24, 1942","The Pomona Assembly Center was located on the Los Angeles County Fairgrounds (Fairplex), California, about thirty miles east of downtown Los Angeles and only twenty miles east of the Santa Anita Assembly Center . Most of its population came from Los Angeles, San Francisco and Santa Clara Counties in California. With a peak population of 5,434, Pomona was operational for 110 days, from May 7 to August 24, 1942. Almost all inmates were sent for long-term confinement to the Heart Mountain , Wyoming War Relocation Authority camp. The camp was afterwards used by the Third Battalion, 56th Quartermaster Regiment, which was already using the adjoining Pomona Fairgrounds.",Located at the Los Angeles County Fairgrounds (Fairplex) in Southern California.,5434,1942-07-20,5434,"Pomona, California",California,34.08138333333333,-117.7641756515293,"Courtesy of the National Archives and Records Administration, Ctrl. #: NWDNS-210-G-B88, NARA ARC #: 536837, WRA, Photographer Clem Albers. Accessed from: https://encyclopedia.densho.org/sources/en-denshopd-i37-00571-1/"
wra,Temporary Assembly Center,25,Mayer,https://encyclopedia.densho.org/Mayer_(detention_facility)/,published,"May 7, 1942","June 2, 1942","The Mayer Assembly Center was the smallest of all ""assembly centers"" and the one open for the shortest time, a mere twenty-seven days. It held Japanese Americans forcibly removed from the restricted areas of the state of Arizona numbering fewer than 250. It was built on the site of a former Civilian Conservation Corps camp about twenty-five miles southeast of Prescott, Arizona. The first inmates arrive at Mayer on May 7, 1942. Inmates from Mayer were all transferred to the Poston, Arizona, concentration camp on June 2, 1942","Located 75 miles northwest of Phoenix, Arizona, Mayer was set on land that was originally farmland.",245,1942-05-25,245,"Mayer, Arizona",Arizona,34.39845,-112.2293472222222,"Courtesy of Sharlot Hall Museum Library/Archives, Prescott, Arizona. Accessed from: https://www.nps.gov/parkhistory/online_books/anthropology74/ce16c.htm"
eais,Department of Justice Internment Camp,27,Santa Fe,https://encyclopedia.densho.org/Santa_Fe_(detention_facility)/,published,February 1942,September 1946,"The Santa Fe Internment Camp held the largest number of Japanese American internees of any of the internment camps run by the Immigration and Naturalization Service (INS) or the army. Santa Fe initially held Issei men from the West Coast who had been arrested in the days and weeks after the attack on Pearl Harbor starting in March 1942. After their hearings, these men were released or paroled to other camps, with Santa Fe closing for the first time in September 1942. The camp reopened in March of 1943 when the army began transferring civilian internees back to INS camps. In 1945, Nisei/Kibei renunciants and Issei from Tule Lake were transferred to Santa Fe, and the population grew to over 2,000. By the time the camp closed for good in May of 1946, 4,555 Japanese American male internees had passed through Santa Fe. A marker overlooking the site of the camp was dedicated in 2002, capping a contentious process that saw vocal local opposition.","Located 2.5 miles west of the Santa Fe city center, this 80-acre site in northern New Mexico included a Civilian Conservation Corps (CCC) camp.",2100,1945-06-01,2100,"Santa Fe, New Mexico",New Mexico,35.69326303561273,-105.9595504336962,Courtesy of the Japanese American National Museum. Accessed from: http://www.discovernikkei.org/en/events/2012/04/14/3580/
eais,Department of Justice Internment Camp,28,Fort Lincoln (Bismarck),https://encyclopedia.densho.org/Fort_Lincoln_(Bismarck)_(detention_facility)/,published,"December 7, 1941","March 6, 1946","Located on a former military post and CCC camp outside of Bismarck, North Dakota, the Fort Lincoln internment camp held a total of 3,850 internees of German and Japanese descent. There were two distinct groups of Japanese American internees. The first consisted of over 1,100 Issei community leaders from the West Coast who arrived in February 1942 before being transferred to other camps later that summer and fall. Three years later, in February 1945, the second group arrived, consisting of over 750 inmates who were thought to be fomenting unrest at Tule Lake. Most were young Nisei who had renounced their American citizenship. Most sailed for Japan at the end of 1945, while others were transferred to Santa Fe. The camp closed on March 6, 1946. The site is now part of the campus of United Tribes Technical College.","Located in Morton County, 5 miles south of Bismarck, North Dakota, on a U.S. Army base.",1100,1942-02-01,1500,"Bismarck, North Dakota",North Dakota,46.76695172532246,-100.758176153208,Courtesy of GAIC - John Christgau Collection. Accessed from: https://gaic.info/internment-camps/u-s-department-of-justice-internment-facilities/fort-lincoln-bismarck-north-dakota/
eais,Department of Justice Internment Camp,29,Crystal City,https://encyclopedia.densho.org/Crystal_City_(detention_facility)/,published,March 1943,January 1948,"Located in Zavala County, Texas just fifty miles from the Mexican border, the Crystal City Internment Camp was an INS camp that housed families who were mostly of German or Japanese descent. A large portion of its population consisted of Japanese and German Latin Americans who had been removed from their homes and brought to the U.S. Most of the Japanese Americans held at Crystal City were those who had expressed a desire to be repatriated/expatriated to Japan. One of the largest of the internment camps, Crystal City held over 3,000 people at the end of 1945, about 2/3 of whom were of Japanese descent. It was the last of the internment camps to close, not shutting down until February 27, 1948.","Located in Zavala County in South Texas, 170 miles west of Corpus Christi. Semiarid grasslands with an average annual rainfall of about 21 inches. Summers are hot and humid, with temperatures exceeding 100 degrees.",2500,,4000,"Crystal City, Texas",Texas,28.69230214940634,-99.8225384119298,"Courtesy of California State University, Sacramento, Department of Special Collections and University Archives. Accessed from: https://ddr.densho.org/ddr-csujad-55-1507/"
eais,Department of Justice Internment Camp,30,Fort Missoula,https://encyclopedia.densho.org/Fort_Missoula_(detention_facility)/,published,"December 18, 1941","July 1, 1944","Army fort that became a Justice Department run internment camp during World War II that held both stranded Italian seamen and Japanese internees. Over a thousand mostly Issei male internees spent time at Missoula in two main groups. The first, consisting mostly of Issei leaders from the West Coast, began arriving shortly after the attack on Pearl Harbor and were mostly transferred to other camps by the summer of 1942. A second group, which included Issei from Hawaii and Japanese Latin Americans, began arriving in the spring of 1943, many remaining until the closing of the camp on July 1, 1944.","Located at an old U.S. Army post on the southwest edge of Missoula, Montana, that was turned over to the Department of Justice (DOJ) in 1941. Missoula is in western Montana.",1000,,2000,"Missoula, Montana",Montana,46.84043491562001,-114.055016514609,"Courtesy of the K. Ross Toole Archives, University of Montana at Missoula (Number 84-295, Pierce Coll.). Accessed from: https://encyclopedia.densho.org/sources/en-ddr-densho-44-3-1/"
wra,Citizen Isolation Center,31,Moab Isolation Center,https://encyclopedia.densho.org/Moab_(detention_facility)/,published,"January 11, 1943","April 27, 1943","WRA detention facility established after ther Manzanar riot/uprising of December 1942 to hold Nisei and Kibei inmates that camp administrators viewed as ""troublemakers"" whom they wanted to remove from general camp populations. Built at a former CCC facility in southeastern Utah, Moab was in operation for about three-and-a-half months, at which point its inmate population was moved to Leupp, a larger facility in Arizona.","Located at Dalton Wells, 13 miles north of Moab in southeastern Utah. Summer temperatures reach the high 90s. Vegetation included sagebrush, tumbleweed, cottonwood, and tamarisk trees. The drab and desolate area was used for stock grazing.",83,,83,"Dalton Wells, Utah",Utah,38.71270330742467,-109.7009066899098,Courtesy of Louthan 1993. Accessed from: https://www.nps.gov/parkhistory/online_books/anthropology74/ce14.htm
wra,Citizen Isolation Center,32,Leupp,https://encyclopedia.densho.org/Leupp_(detention_facility)/,published,"April 27, 1943","December 2, 1943","High security WRA detention facility for Nisei and Kibei inmates that camp administrators viewed as ""troublemakers"" whom they wanted to remove from general camp populations. Larger and more prison-like than its predecessor, the Moab (Utah) Isolation Center, Leupp was located in northeastern Arizona and was in operation for a little over six months in 1943. Alarmed by the arbitrary way that WRA camp directors were choosing inmates to send to Leupp, Leupp administrators appealed to the national WRA leadership, which ultimately decided to close the camp in December 1943, sending its remaining inmates to the segregation center at Tule Lake.","The Leupp camp, in the high desert of northeastern Arizona about 30 miles northwest of Winslow, was located at an abandoned Navajo Indian Reservation boarding school.",100,,50 to 100,"Leupp, Arizona",Arizona,35.29756034335197,-110.9905412770152,Courtesy of Museum of Northern Arizona Photo Archives. Accessed from: https://www.nps.gov/parkhistory/online_books/anthropology74/ce14b.htm
wra,U.S. Federal Prison,33,McNeil Island Federal Penitentiary,https://encyclopedia.densho.org/McNeil_Island_Penitentiary_(detention_facility)/,published,"July 10, 1944",April 1947,"Federal prison facility on an island in Puget Sound, Washington, at which around eighty-five Nisei draft resisters from Heart Mountain and Minidoka served their sentences.","Work prison located on an island in the southern portion of Puget Sound, 10 miles southwest of Tacoma, Washington. Currently a medium-security state correctional facility holding about 1,000 male inmates.",85,,85,"McNeil Island, Washington",Washington,47.19720826967585,-122.6584119573263,"Courtesy of the National Archives and Records Administration (Ctrl.#: NRIS-129-MCNEILPHOTOS-HIST1; NARA ARC#: 299516; Department of Justice, Bureau of Prisons). Accessed from: https://encyclopedia.densho.org/sources/en-denshopd-i37-00839-1/"
eais,U.S. Army Internment Camp,34,Lordsburg,https://encyclopedia.densho.org/Lordsburg_(detention_facility)/,published,"June 15, 1942",1944,"The Lordsburg Internment Camp was the largest of the army-run internment camps holding Japanese Americans in the continental U.S. and the only one specifically built to house enemy aliens. It was located outside the small town of Lordsburg, New Mexico in the southwest corner of the state, at an elevation of about 4,000 feet. Lordsburg operated as an internment camp for about a year, from June 1942 to June 1943, and had a peak population of about 1,500. While most of the internees were from the continental U.S., there was a substantial contingent from Hawai'i, as well as a handful from Alaska. Two Issei internees were shot and killed in July 1942 while walking to the camp from the train; there was also a bitter dispute between internees and camp administrators over forced manual labor outside of the camp in the first few months. Over time, internees established a community that included a newspaper, religious services, and recreational activities such as gardening, arts and crafts, performing arts, and sports. In the spring and summer of 1943, internees were moved in groups to camps run by the Justice Department—most to one in Santa Fe—in order to clear room for prisoners of war. Lordsburg subsequently held as many as 4,000 Italian and German POWs.","Located on 1,300 acres of desert land near Lordsburg in southwest New Mexico.",1500,,1500,"Lordsburg, New Mexico",New Mexico,32.30823447113556,-108.6541855457783,Courtesy of Confinment And Ethnicity via National Parks Service. Accessed from: https://www.nps.gov/parkhistory/online_books/anthropology74/ce17l.htm
eais,Department of Justice Internment Camp,35,Fort Stanton,https://encyclopedia.densho.org/Fort_Stanton_(detention_facility)/,published,March 1945,October 1945,"Former CCC camp in southern New Mexico that was initially used to intern German seamen and later more troublesome German internees transfered from other detention facilities. In 1945, it was used as segregation camp for Nikkei dissidents transferred from Santa Fe.","The Fort Stanton Internment Camp in central New Mexico was the first detention facility opened by the Immigration and Naturalization Service and mostly held German seamen and German enemy aliens. In 1945, it became a secret detention camp where seventeen Nikkei inmates removed from the Santa Fe camp for disciplinary reasons were held for around six months.",17,,650,"Fort Stanton, New Mexico",New Mexico,33.49766453311105,-105.5289017945782,Courtesy of fortstanton.org. Accessed from: https://www.fortstanton.org/internment-camp
